{
  "version": "1",
  "dialect": "duckdb-factor-v1",
  "evaluation_type": "cross_sectional",
  "data_source": "yhydev97/quant-data",
  "signal_sql": "(quote_volume / GREATEST(count, 1.0)) - LAG(quote_volume / GREATEST(count, 1.0), 6) OVER w",
  "postprocess": "cs_zscore",
  "universe": {
    "dropna": [
      "open",
      "high",
      "low",
      "close"
    ],
    "min_symbol_bars": 168,
    "cs_quantile_gte": {
      "col": "quote_volume",
      "q": 0.2
    }
  }
}
