{
  "version": "1",
  "dialect": "duckdb-factor-v1",
  "evaluation_type": "cross_sectional",
  "data_source": "yhydev97/quant-data",
  "signal_sql": "CASE WHEN (high - low) / close > 1e-4 THEN (quote_volume / (high - low + 1e-8)) / (QUANTILE_CONT(quote_volume / (high - low + 1e-8), 0.5) OVER (w ROWS BETWEEN 23 PRECEDING AND CURRENT ROW) + 1e-8) ELSE NULL END",
  "postprocess": "cs_rank",
  "universe": {
    "dropna": [
      "open",
      "high",
      "low",
      "close"
    ],
    "min_symbol_bars": 72,
    "cs_quantile_gte": {
      "col": "quote_volume",
      "q": 0.2
    }
  }
}
