{
  "version": "1",
  "dialect": "duckdb-factor-v1",
  "evaluation_type": "cross_sectional",
  "data_source": "yhydev97/quant-data",
  "signal_sql": "(taker_buy_volume / NULLIF(volume, 0) - AVG(taker_buy_volume / NULLIF(volume, 0)) OVER (PARTITION BY symbol ORDER BY open_time ROWS BETWEEN 23 PRECEDING AND CURRENT ROW)) / NULLIF(STDDEV_SAMP(taker_buy_volume / NULLIF(volume, 0)) OVER (PARTITION BY symbol ORDER BY open_time ROWS BETWEEN 23 PRECEDING AND CURRENT ROW), 0)",
  "postprocess": "cs_rank",
  "universe": {
    "dropna": [
      "open",
      "high",
      "low",
      "close",
      "volume",
      "taker_buy_volume"
    ],
    "min_symbol_bars": 168,
    "cs_quantile_gte": {
      "col": "quote_volume",
      "q": 0.2
    }
  }
}
